<?xml version="1.0" encoding="UTF-8"?>
<!-- edited with XMLSpy v2006 rel. 3 sp1 (http://www.altova.com) by Steven Laursen (CSC Airline solutions Danmark) -->
<xs:schema xmlns:xs="http://www.w3.org/2001/XMLSchema" elementFormDefault="qualified" attributeFormDefault="unqualified">
	<xs:element name="crewMessage">
		<xs:annotation>
			<xs:documentation>Comment describing your root element</xs:documentation>
		</xs:annotation>
		<xs:complexType>
			<xs:sequence>
				<xs:element name="messageName" type="xs:string"/>
				<xs:element name="messageBody">
					<xs:complexType>
						<xs:sequence>
							<xs:element name="crewEmpnoNameSnapshot" type="crewNameEmpnoSnapshot"/>
						</xs:sequence>
					</xs:complexType>
				</xs:element>
			</xs:sequence>
			<xs:attribute name="version" type="xs:string"/>
		</xs:complexType>
	</xs:element>
	<xs:complexType name="crewNameEmpnoSnapshot">
		<xs:sequence>
			<xs:element name="crew" minOccurs="0" maxOccurs="unbounded">
				<xs:complexType>
					<xs:sequence>
						<xs:element name="crewId" type="xs:string"/>
						<xs:element name="name" type="xs:string"/>
						<xs:element name="crewEmpnoPeriods">
							<xs:complexType>
								<xs:sequence>
									<xs:element name="crewEmpnoPeriod" type="crewEmpnoPeriod" minOccurs="0" maxOccurs="unbounded"/>
								</xs:sequence>
							</xs:complexType>
						</xs:element>
					</xs:sequence>
				</xs:complexType>
			</xs:element>
		</xs:sequence>
		<xs:attribute name="version" type="xs:string"/>
	</xs:complexType>
	<xs:complexType name="crewEmpnoPeriod">
		<xs:sequence>
			<xs:element name="startDate" type="xs:date"/>
			<xs:element name="endDate" type="xs:date"/>
			<xs:element name="empno" type="xs:string"/>
		</xs:sequence>
	</xs:complexType>
</xs:schema>
