<?xml version="1.0" encoding="UTF-8"?>
<!--Sample XML file generated by XMLSpy v2006 rel. 3 sp1 (http://www.altova.com)-->
<crewMessage xmlns:xsi="http://www.w3.org/2001/XMLSchema-instance" xsi:noNamespaceSchemaLocation="..\crewEmpnoNameSnapshot.xsd" version="1.00">
	<messageName>CrewEmpnoNameSnapshot</messageName>
	<messageBody>
		<crewEmpnoNameSnapshot version="1.00">
			<crew>
				<crewId>SK  12345</crewId>
				<name>ANDERS HANSEN</name>
				<crewEmpnoPeriods>
					<crewEmpnoPeriod>
						<startDate>1967-08-13</startDate>
						<endDate>1997-08-13</endDate>
						<empno>12345</empno>
					</crewEmpnoPeriod>
					<crewEmpnoPeriod>
						<startDate>1997-08-14</startDate>
						<endDate>2099-08-13</endDate>
						<empno>22345</empno>
					</crewEmpnoPeriod>
				</crewEmpnoPeriods>
			</crew>
			<crew>
				<crewId>SK  34567</crewId>
				<name>JAN SOLBAKKEN</name>
				<crewEmpnoPeriods>
					<crewEmpnoPeriod>
						<startDate>1977-08-13</startDate>
						<endDate>1999-08-13</endDate>
						<empno>String</empno>
					</crewEmpnoPeriod>
					<crewEmpnoPeriod>
						<startDate>1999-08-14</startDate>
						<endDate>2099-08-13</endDate>
						<empno>String</empno>
					</crewEmpnoPeriod>
				</crewEmpnoPeriods>
			</crew>
		</crewEmpnoNameSnapshot>
	</messageBody>
</crewMessage>
